{
  "version": "1.0.0",
  "lastUpdated": "2026-09-19",
  "exam": "Anthropic Claude Certified Associate",
  "totalTerms": 24,
  "domains": [
    {
      "name": "Output Formats & Feature Selection",
      "description": "Selection criteria between Artifacts vs Inline Markdown, code vs text, and UI features (Projects, Artifacts, Research Mode).",
      "weightPercentage": 22
    },
    {
      "name": "Prompting & Task Decomposition",
      "description": "System prompts, XML tagging, chain-of-thought, few-shot conditioning, and multi-step decomposition.",
      "weightPercentage": 20
    },
    {
      "name": "Model Selection & Context Management",
      "description": "Haiku vs Sonnet vs Opus trade-offs, 200k context window dynamics, prompt caching, and memory reset strategies.",
      "weightPercentage": 18
    },
    {
      "name": "Evaluation, Fact-Checking & Safety",
      "description": "Hallucination mitigation, human-in-the-loop triggers, verification checks, and bias auditing.",
      "weightPercentage": 15
    },
    {
      "name": "Projects & Knowledge Management",
      "description": "Custom project instructions, vector and file grounding, connectors (Google Drive, Gmail), and context curation.",
      "weightPercentage": 10
    },
    {
      "name": "API Mechanics & Tool Use",
      "description": "JSON schema definition, stop_reason='tool_use', multi-turn tool loops, and client error handling.",
      "weightPercentage": 15
    }
  ],
  "terms": [
    {
      "id": "artifacts",
      "term": "Artifacts",
      "domain": "Output Formats & Feature Selection",
      "tier": "Associate",
      "shortDefinition": "A dedicated secondary UI pane rendered when Claude generates substantial (>15 lines), self-contained content intended to be modified, shared, or executed independently of the chat thread.",
      "officialExamTopic": "Organize and curate information for optimal outputs; select appropriate output formats (artifacts for code/documents, inline for conversational responses)",
      "examImportance": "Critical",
      "confirmedCurriculumGap": true,
      "keyExamTrap": {
        "myth": "Artifacts should be triggered for any short code snippet or explanatory text block.",
        "reality": "Artifacts are reserved for self-contained, high-value assets (>15 lines) meant for standalone reuse (e.g., SVG, React code, complete docs). Short snippets stay inline.",
        "examClue": "Look for questions asking where a 3-line terminal command vs a 200-line React component should render."
      },
      "codeOrSyntaxSnippet": "<antArtifact identifier=\"dashboard-component\" type=\"application/vnd.ant.react\" title=\"Analytics Dashboard\">",
      "video16sBlueprint": {
        "hook": "Why does Claude put some code in a side window?",
        "conceptPart1": "That's an Artifact! It's for standalone, reusable code over 15 lines.",
        "conceptPart2": "Quick answers and 3-line scripts always stay inline in chat.",
        "ctaExamTip": "Exam Tip: Standalone files equal Artifacts, quick chat stays inline!"
      },
      "relatedTermIds": [
        "inline-markdown",
        "claude-projects",
        "output-formatting"
      ],
      "keyframeVisualSpec": {
        "initialFramePrompt": "Initial state representing 'Artifacts' in Claude AI architecture: Why does Claude put some code in a side window and some directly in chat?. Glowing terracotta UI terminal wireframe, sleek dark obsidian console, floating translucent panels displaying Anthropic iconography, 3D isometric glassmorphic interface, Anthropic terracotta accents (#CC785C) and deep obsidian (#18181B) metallic chassis, clean octane render, studio lighting, hyper-realistic, vertical 9:16 aspect ratio",
        "endFramePrompt": "Resolved target state for 'Artifacts' concept: Conversational replies and quick 3-line snippets always stay inline to avoid cluttering your workspace.. Translucent illuminated 3D glass data nodes connecting into a glowing gold Anthropic verification badge, crystal-clear code pathways, Exam Tip: Candidates failed this at 0%! Remember: standalone and reusable equals Artifact, quick explanation equals inline!, 3D isometric glassmorphic interface, Anthropic terracotta accents (#CC785C) and deep obsidian (#18181B) metallic chassis, clean octane render, studio lighting, hyper-realistic, vertical 9:16 aspect ratio",
        "cameraMotion": "Cinematic slow forward dolly zoom with subtle 15-degree lateral orbit, smooth depth-of-field transition focusing on illuminated data flows",
        "styleAnchor": "3D isometric glassmorphic interface, Anthropic terracotta accents (#CC785C) and deep obsidian (#18181B) metallic chassis, clean octane render, studio lighting, hyper-realistic, vertical 9:16 aspect ratio"
      },
      "pinnedComment": "\ud83d\udccc Mastered Artifacts vs Inline Markdown? Don't let this trick question cost you points on the Claude Certified Associate Exam! \ud83c\udfaf Grab the full interactive 24-term exam blueprint and flashcards free inside Delivery Pilot: \ud83d\udc49 https://www.skool.com/delivery-pilot-8938\n\n\ud83d\udc47 Quick Quiz: Would you put a 25-line React component or a 3-line curl command in an Artifact window? Drop your answer below!",
      "pinnedCommentHookTopic": "Artifacts vs Inline Markdown Decision Matrix"
    },
    {
      "id": "inline-markdown",
      "term": "Inline Markdown",
      "domain": "Output Formats & Feature Selection",
      "tier": "Associate",
      "shortDefinition": "The default output format rendered directly within the conversational message stream for immediate reading, short code snippets, explanations, and dialogue.",
      "officialExamTopic": "Organize and curate information for optimal outputs; select appropriate output formats",
      "examImportance": "Critical",
      "confirmedCurriculumGap": true,
      "keyExamTrap": {
        "myth": "All structured markdown tables require an Artifact window.",
        "reality": "Tables, bullet points, and brief code snippets belong inline unless explicitly intended for standalone export or iterative drafting.",
        "examClue": "Questions emphasizing rapid back-and-forth iteration without standalone document extraction."
      },
      "video16sBlueprint": {
        "hook": "Should Claude open an Artifact or stay in chat?",
        "conceptPart1": "Inline Markdown is for conversation flow, explanations, and quick terminal snippets.",
        "conceptPart2": "Creating an Artifact for short text interrupts user flow.",
        "ctaExamTip": "Exam Tip: If code doesn't need file export, keep it inline!"
      },
      "relatedTermIds": [
        "artifacts",
        "output-formatting"
      ],
      "keyframeVisualSpec": {
        "initialFramePrompt": "Initial state representing 'Inline Markdown' in Claude AI architecture: Should Claude generate an Artifact or stay inline in the chat?. Glowing terracotta UI terminal wireframe, sleek dark obsidian console, floating translucent panels displaying Anthropic iconography, 3D isometric glassmorphic interface, Anthropic terracotta accents (#CC785C) and deep obsidian (#18181B) metallic chassis, clean octane render, studio lighting, hyper-realistic, vertical 9:16 aspect ratio",
        "endFramePrompt": "Resolved target state for 'Inline Markdown' concept: Creating an Artifact for a short response interrupts the user's flow and wastes layout real estate.. Translucent illuminated 3D glass data nodes connecting into a glowing gold Anthropic verification badge, crystal-clear code pathways, Associate Exam Rule: If the user doesn't need to export, compile, or iterate on the code as a file, keep it inline!, 3D isometric glassmorphic interface, Anthropic terracotta accents (#CC785C) and deep obsidian (#18181B) metallic chassis, clean octane render, studio lighting, hyper-realistic, vertical 9:16 aspect ratio",
        "cameraMotion": "Cinematic slow forward dolly zoom with subtle 15-degree lateral orbit, smooth depth-of-field transition focusing on illuminated data flows",
        "styleAnchor": "3D isometric glassmorphic interface, Anthropic terracotta accents (#CC785C) and deep obsidian (#18181B) metallic chassis, clean octane render, studio lighting, hyper-realistic, vertical 9:16 aspect ratio"
      },
      "pinnedComment": "\ud83d\udccc Should Claude open a side Artifact or stay directly in chat? Keeping conversational replies and short snippets inline protects user workflow! \u26a1 Master all Claude UI mechanics and exam blueprints inside Delivery Pilot: \ud83d\udc49 https://www.skool.com/delivery-pilot-8938\n\n\ud83d\udc47 When do you prefer inline chat over an Artifact window? Let's discuss in the comments!",
      "pinnedCommentHookTopic": "Inline Chat Flow & Workspace Ergonomics"
    },
    {
      "id": "task-decomposition",
      "term": "Task Decomposition",
      "domain": "Prompting & Task Decomposition",
      "tier": "Associate",
      "shortDefinition": "The prompting method of breaking down a large, multifaceted problem into sequential sub-tasks, minimizing cognitive overload and intermediate error propagation.",
      "officialExamTopic": "Apply task decomposition techniques to structure complex requests",
      "examImportance": "Critical",
      "confirmedCurriculumGap": false,
      "keyExamTrap": {
        "myth": "Providing a single mega-prompt with 10 complex requirements is faster and equally accurate.",
        "reality": "Decomposed prompts allow Claude to verify intermediate outputs, dramatically reducing compounding hallucinations.",
        "examClue": "Scenarios involving multi-step audits, legal contract comparisons, or multi-tier code refactoring."
      },
      "codeOrSyntaxSnippet": "Step 1: Extract entities.\nStep 2: Compare against compliance checklist.\nStep 3: Output final discrepancy table.",
      "video16sBlueprint": {
        "hook": "Why does Claude fail on three complex jobs at once?",